[
  {
    "id": "lmarena",
    "name": "Arenna of the Blind Tasting",
    "title": "Keeper of the Thousand Votes",
    "represents": "LMArena / LMSYS Chatbot Arena",
    "source_url": "https://lmarena.ai",
    "source_kind": "product",
    "verified": true,
    "signal": "Crowdsourced pairwise blind-vote leaderboard; millions of human battles ranking frontier models by Elo since 2023 (formerly chat.lmsys.org)",
    "virality": "viral",
    "class": "Arbiter",
    "subclass": "Order of the Blind Tasting",
    "lineage": "Half-Construct (model-agnostic)",
    "background": "Arena Judge",
    "alignment": "Lawful Neutral",
    "level": 12,
    "ac": 17,
    "hp": "the crowd's patience",
    "prof": 4,
    "initiative": 2,
    "temperature": 0.3,
    "retrieval_index": "two unlabeled answers and a crowd of human votes",
    "adventures": ["the-proving-grounds"],
    "abilities": {
      "str": 10,
      "dex": 13,
      "con": 16,
      "int": 15,
      "wis": 17,
      "cha": 14
    },
    "saves": ["wis", "cha"],
    "skills": ["Insight +7", "Perception +7", "Persuasion +6"],
    "weapon": "The covered cup (two answers, no names — you vote on the wine, not the label)",
    "armor": "Blind Tasting — names are stripped before judgment, so hype lands no blows",
    "feature": "Pairwise Verdict: never scores in isolation; only ever asks 'this one, or that one?' and tallies the crowd",
    "origin": "Born when researchers got tired of cherry-picked demos and let a stadium of strangers vote blind, A vs B, a million times over",
    "tagline": "Take the label off and let the crowd taste the wine.",
    "role": "party",
    "log": [
      {
        "v": "lmsys→lmarena",
        "change": "Rehoused from chat.lmsys.org to lmarena.ai; vote count and category boards expanded",
        "why": "The blind-vote board became the number the whole industry argued about; it needed a home that could carry the traffic"
      }
    ]
  },
  {
    "id": "helm",
    "name": "Helm of the Many Axes",
    "title": "Adjudicator Who Refuses One Number",
    "represents": "HELM — Holistic Evaluation of Language Models (Stanford CRFM)",
    "source_url": "https://crfm.stanford.edu/helm/",
    "source_kind": "product",
    "verified": true,
    "signal": "Stanford CRFM's standardized, multi-metric benchmark suite; scores models across accuracy, calibration, robustness, fairness, bias, toxicity, and efficiency rather than one headline score",
    "virality": "idiomatic",
    "class": "Loremaster",
    "subclass": "Order of the Many Axes",
    "lineage": "Half-Construct (Stanford-forged)",
    "background": "Holistic Examiner",
    "alignment": "Lawful Good",
    "level": 11,
    "ac": 18,
    "hp": "a hundred scenarios",
    "prof": 4,
    "initiative": -1,
    "temperature": 0.2,
    "retrieval_index": "a transparent matrix of scenarios × metrics",
    "adventures": ["the-proving-grounds"],
    "abilities": {
      "str": 9,
      "dex": 10,
      "con": 17,
      "int": 19,
      "wis": 16,
      "cha": 11
    },
    "saves": ["int", "wis"],
    "skills": ["Investigation +8", "History +8", "Insight +7"],
    "weapon": "The seven-axis scale (one strike per dimension — never a single verdict)",
    "armor": "Holistic Doctrine — a champion who wins one axis and dumps the rest is unmasked, not crowned",
    "feature": "No Single Number: refuses to collapse a model to one score; reports the whole matrix or nothing",
    "origin": "Raised by a research center that watched leaderboards reward one cherry-picked metric and decided to grade the whole transcript instead",
    "tagline": "There is no one number. There is the whole matrix, and it is unflattering.",
    "role": "party",
    "log": [
      {
        "v": "v1→Lite/HEIM/Safety",
        "change": "Forked into specialized scoreboards (instruction-following, image models, safety) while keeping the holistic core",
        "why": "One matrix could not hold every new modality; the doctrine of 'grade everything' scaled by splitting, not by simplifying"
      }
    ]
  },
  {
    "id": "eval-harness",
    "name": "Harn the Reproducible",
    "title": "Artificer of the Rig That Runs the Same Twice",
    "represents": "EleutherAI lm-evaluation-harness",
    "source_url": "https://github.com/EleutherAI/lm-evaluation-harness",
    "source_kind": "github",
    "verified": true,
    "signal": "The open-source de-facto standard rig for LLM benchmarking; backbone of Hugging Face's Open LLM Leaderboard; hundreds of standardized tasks, one reproducible command",
    "virality": "idiomatic",
    "class": "Artificer",
    "subclass": "The Reproducible Rig",
    "lineage": "Half-Construct (open-weight, EleutherAI-forged)",
    "background": "Bench Mechanic",
    "alignment": "Lawful Neutral",
    "level": 10,
    "ac": 16,
    "hp": "as much as you allocate",
    "prof": 4,
    "initiative": 1,
    "temperature": 0.1,
    "retrieval_index": "pinned task versions, fixed prompts, frozen seeds",
    "adventures": ["the-proving-grounds"],
    "abilities": {
      "str": 12,
      "dex": 16,
      "con": 15,
      "int": 17,
      "wis": 13,
      "cha": 8
    },
    "saves": ["int", "dex"],
    "skills": ["Investigation +7", "Arcana +7", "Sleight of Hand +7"],
    "weapon": "The pinned config (a benchmark you can re-run and get the same number)",
    "armor": "Version-Locked — 'it scored higher' means nothing unless you ran the same task version",
    "feature": "Run It Again: any claimed score can be reproduced from the rig, or it is not a score",
    "origin": "Built by an open lab so that 'state of the art' would mean a command anyone could run, not a screenshot anyone could fake",
    "tagline": "If you can't re-run it, you didn't measure it.",
    "role": "party",
    "log": [
      {
        "v": "v0.3→v0.4",
        "change": "Task versioning hardened; standardized prompts and few-shot pinning added",
        "why": "Two labs reported different numbers on the 'same' benchmark; pinning versions made the leaderboard mean something again"
      }
    ]
  },
  {
    "id": "goodhart",
    "name": "Goodhart the Gamed",
    "title": "The Measure That Became a Target",
    "represents": "Goodhart's Law — 'when a measure becomes a target, it ceases to be a good measure'",
    "source_url": "https://en.wikipedia.org/wiki/Goodhart%27s_law",
    "source_kind": "wikipedia",
    "verified": true,
    "virality": "idiomatic",
    "lineage": "Metric-born (turned)",
    "alignment": "Chaotic Neutral",
    "cr": "8 (proxy-bound)",
    "role": "monster",
    "adventures": ["the-proving-grounds"],
    "abilities": {
      "str": 16,
      "dex": 18,
      "con": 13,
      "int": 14,
      "wis": 5,
      "cha": 19
    },
    "dumped_save": "wis",
    "tagline": "He aces every test you let him see. Hand him a fresh one and the crown turns to ash."
  }
]
